<?xml version="1.0" encoding="UTF-8"?>
<xs:schema xmlns:xs="http://www.w3.org/2001/XMLSchema">
    <xs:element name="personas">
        <xs:complexType>
            <xs:sequence>
                <xs:element name="persona" maxOccurs="unbounded">
                    <xs:complexType>
                        <xs:sequence>
                            <xs:element name="nombre" type="xs:string" />
                            <xs:element name="sexo" type="xs:string" />
                            <xs:element name="fecha_nacimiento">
                                <xs:complexType>
                                    <xs:sequence>
                                        <xs:element name="dia" type="xs:string" />
                                        <xs:element name="mes" type="xs:string" />
                                        <xs:element name="anyo" type="xs:string" />
                                    </xs:sequence>
                                </xs:complexType>
                            </xs:element>
                            <xs:element name="ciudad" type="xs:string" />
                        </xs:sequence>
                    </xs:complexType>
                </xs:element>
            </xs:sequence>
            <xs:attribute name="dni" use="required" />
        </xs:complexType>
    </xs:element>
</xs:schema>