<?xml version="1.0" encoding="UTF-8"?>
    <!-- COMENTARIO -->
<?xml-stylesheet type="text/css" href="estilos/estilos.css"?>
<personas dni="12345678A" xmlns:xsi="http://www.w3.org/2001/XMLSchema-instance" xsi:noNamespaceSchemaLocation="personas.xsd">
    <!-- CREA EL XSD AUTOMÁTICAMENTE -->
    <persona>
        <nombre>Elena</nombre>
        <sexo>Mujer</sexo>
        <fecha_nacimiento>
            <dia>12</dia>
            <mes>2</mes>
            <anyo>2001</anyo>
        </fecha_nacimiento>
        <ciudad>Madrid</ciudad>
    </persona>
    <persona>
        <nombre>Juan</nombre>
        <sexo>Hombre</sexo>
        <fecha_nacimiento>
            <dia>24</dia>
            <mes>2</mes>
            <anyo>2001</anyo>
        </fecha_nacimiento>
        <ciudad>Sevilla</ciudad>
    </persona>
    <persona>
        <nombre>Manuel</nombre>
        <sexo>Hombre</sexo>
        <fecha_nacimiento>
            <dia>8</dia>
            <mes>2</mes>
            <anyo>2009</anyo>
        </fecha_nacimiento>
        <ciudad>Sevilla</ciudad>
    </persona>
</personas>